{
  "schemaVersion": "1.0.0",
  "contractVersion": "phase-5-pilot-evidence-v1",
  "phaseId": "P5",
  "currentValidationRevision": 1,
  "validationHistory": [],
  "cohort1": {
    "cohortId": "cohort-1",
    "state": "ready",
    "validationRevision": 1,
    "releaseSha": "28c4f93cc1a77c9452cf593ad07a2a05c19d1ce4",
    "domainId": "small-ecommerce-powerful-customer-services-v1",
    "datasource": "stack-exchange",
    "mode": "live",
    "g02Decision": "not-evaluated",
    "primaryParticipantCount": 0,
    "primarySessionCount": 0,
    "initiatedLiveScanAttempts": 0,
    "completedLiveScanAttempts": 0,
    "primarySessionsWithSavedOpportunity": 0,
    "usefulnessRatingCount": 0,
    "usefulnessRatingSum": 0,
    "evidenceQualityRatingCount": 0,
    "evidenceQualityRatingSum": 0,
    "rankingQualityRatingCount": 0,
    "rankingQualityRatingSum": 0,
    "displayedLiveOpportunityCount": 0,
    "displayedLiveOpportunityWithEvidenceAndProvenanceCount": 0,
    "voluntaryRepeatParticipantCount": 0,
    "fixtureSessionCount": 0,
    "liveSessionCount": 0,
    "criticalSecretExposureCount": 0,
    "unauthorizedAccessIncidentCount": 0,
    "dataLossIncidentCount": 0,
    "criticalReliabilityIncidentCount": 0
  },
  "cohort2": null
}
